{
  "schema_version": "findings.v1",
  "document_id": "NDA-003",
  "analysis_path": "ai",
  "status": "completed",
  "contract_type": "mutual_nda",
  "template_id": "TPL-MNDA-UK-1.3",
  "playbook_id": "PB-MNDA-UK-1.0",
  "findings": [
    {
      "finding_id": "NDA-003-F-001",
      "document_id": "NDA-003",
      "clause_id": "NDA-003-CLAUSE-008",
      "clause_type": "liability",
      "candidate_issue": "unlimited_liability",
      "template_clause_id": "TPL-MNDA-LIABILITY-001",
      "evidence": [
        {
          "source": "contract",
          "source_id": "NDA-003",
          "quote": "Each party accepts unlimited liability under this agreement.",
          "start_char": 912,
          "end_char": 972
        }
      ],
      "summary": "The draft replaces the template liability cap with unlimited liability.",
      "why_it_matters": "The change creates uncapped financial exposure for both parties.",
      "suggested_redline": "Restore the mutual twelve-month liability cap.",
      "confidence": 0.98
    }
  ],
  "confidence": 0.97,
  "audit": {
    "document_id": "NDA-003",
    "analysis_path": "ai",
    "model": "configured-model-id",
    "prompt_version": "contract-review.v1",
    "schema_version": "findings.v1",
    "playbook_version": null,
    "template_version": "1.3",
    "generated_at": "2026-08-26T12:00:00Z",
    "wall_time_ms": 2841,
    "usage": {
      "prompt_tokens": 1234,
      "completion_tokens": 456,
      "total_tokens": 1690
    },
    "cost_usd": null
  }
}
